,inci,title,peh_class
0,"['\xa0Aqua [Water]', 'Cetyl alcohol', 'Behenamidopropyl dimethylamine', 'Butyrospermum parkii (Shea butter) butter', 'Sesamum indicum (Sesame) seed oil (*)', 'Citrus aurantium dulcis (Orange) peel oil (*)', 'Citrus limon (Lemon) peel oil (*)', 'Citrus aurantium dulcis (Orange) flower extract (*)', 'Calendula officinalis flower extract (*)', 'Chamomilla recutita (Matricaria) flower extract (*)', 'Citrus limon (Lemon) peel extract (*)', 'Soy amino acids', 'Wheat amino acids', 'Arginine HCl', 'Serine', 'Threonine', 'Lactic acid', 'Sorbitol', 'Benzyl alcohol', 'Limonene', 'Sodium benzoate', 'Sodium dehydroacetate', 'Glycerin', 'Xanthan gum* z kontrolowanych upraw ekologicznych']","ALKEMILLA Balsamo Arancio e Limone Odżywka do włosów suchych, cienkich i farbowanych 250ml",E
1,"['\xa0Aqua [Water]', 'Cetyl alcohol', 'Behenamidopropyl dimethylamine', 'Butyrospermum parkii (Shea butter) butter', 'Helianthus annuus (Sunflower) seed oil (*)', 'Citrus medica vulgaris peel oil', 'Foeniculum vulgare (Fennel) oil', 'Aloe barbadensis leaf extract (*)', 'Malva sylvestris (Mallow) flower/leaf extract (*)', 'Foeniculum vulgare (Fennel) fruit extract (*)', 'Althaea officinalis root extract (*)', 'Fructose', 'Glycine', 'Inositol', 'Niacinamide', 'Urea', 'Sodium lactate', 'Sodium PCA', 'Lactic acid', 'Sorbitol', 'Benzyl alcohol', 'Sodium benzoate', 'Sodium dehydroacetate', 'Limonene', 'Glycerin', 'Xanthan gum', 'Linalool', 'Citral* z kontrolowanych upraw ekologicznych']",ALKEMILLA Balsamo Cedro e Finocchio Odżywka do włosów słabych i zniszczonych 250ml,E
2,"[' Aqua [Water]', ' Cetyl alcohol', ' Behenamidopropyl dimethylamine', ' Butyrospermum parkii (Shea butter) butter (*)', ' Olea europaea (Olive) fruit oil (*)', ' Lavandula hybrida oil (*)', ' Eucalyptus globulus leaf oil (*)', ' Equisetum arvense leaf extract (*)', ' Eucalyptus globulus leaf extract (*)', ' Lavandula angustifolia (Lavender) extract (*)', ' Urtica dioica (Nettle) extract (*)', ' Lactic acid', ' Sorbitol', ' Benzyl alcohol', ' Sodium benzoate', ' Sodium dehydroacetate', ' Glycerin', ' Linalool', ' Limonene', ' Xanthan gum.* z kontrolowanych upraw ekologicznych']",ALKEMILLA Balsamo Lavendo e Eucalipto Odżywka do włosów normalnych i przetłuszczających się 250ml,E
3,"['\xa0Aqua [Water] (Eau)', ' Cetyl alcohol', ' Stearyl alcohol', ' Passiflora incarnata flower extract (*)', ' Citrus aurantium dulcis (Orange) flower extract (*)', ' Citrus limon (Lemon) peel extract (*)', ' Morus nigra fruit extract', ' Vaccinium myrtillus (Myrtle) fruit extract (*)', ' Tocopherol', ' Glycerin', ' Dipalmitoylethyl hydroxyethylmonium methosulfate', ' Benzyl alcohol', ' Behenamidopropyl dimethylamine', ' Parfum [Fragrance]', ' Lactic acid', ' Benzoic acid', ' CI 60730 [Acid Violet 43]', ' Dehydroacetic acid', ' Hydroxycitronellal.*z rolnictwa ekologicznego']",ALKEMILLA K-HAIR Anti-Giallo Odżywka ochładzająca kolor do włosów blond i rozjaśnianych 200ml,E
4,"[' Aqua [Water] (Eau)', ' Stearyl alcohol', ' Behenamidopropyl dimethylamine', ' Dodecane', ' Myristyl myristate', ' Lactic acid', ' Linum usitatissimum (Linseed) seed extract (*)', ' Prunus amygdalus dulcis (Sweet almond) fruit extract (*)', ' Vanilla planifolia fruit extract', ' Avena sativa (Oat) kernel extract (*)', ' Panicum miliaceum (Millet) seed extract (*)', ' Helianthus annuus (Sunflower) seed extract (*)', ' Helianthus annuus (Sunflower) seed oil', ' Linseed acid', ' Ascorbyl palmitate', ' Tocopheryl acetate', ' Retinyl palmitate', ' Panthenol', ' Glycerin', ' Benzyl alcohol', ' Parfum [Fragrance]', ' Sodium benzoate', ' Sodium dehydroacetate', ' Hydroxycitronellal.  * z ekologicznych upraw']",ALKEMILLA K-HAIR Multiwitaminowa maska do włosów 200ml,E
5,"['\xa0Aqua [Water] (Eau)', ' Cetyl alcohol', ' Stearyl alcohol', ' Linum usitatissimum (Linseed) seed oil', ' Linum usitatissimum (Linseed) seed extract (*)', ' Prunus amygdalus dulcis (Sweet almond) fruit extract (*)', ' Cocos nucifera (Coconut) fruit extract (*)', ' Avena sativa (Oat) kernel extract (*)', ' Panicum miliaceum (Millet) seed extract (*)', ' Helianthus annuus (Sunflower) seed extract (*)', ' Hydrolyzed quinoa', ' Tocopherol', ' Glycerin', ' Dipalmitoylethyl hydroxyethylmonium methosulfate', ' Benzyl alcohol', ' Behenamidopropyl dimethylamine', ' Parfum [Fragrance]', ' Lactic acid', ' Benzoic acid', ' Dehydroacetic acid', ' Coumarin.* z kontrolowanych upraw ekologicznych']",ALKEMILLA K-HAIR Odżywka do włosów kręconych i falowanych 200ml,E
6,"['\xa0Aqua [Water] (Eau)', ' Cetyl alcohol', ' Stearyl alcohol', ' Helichrysum italicum flower extract (*)', ' Equisetum arvense leaf extract (*)', ' Coffea arabica (Coffee) seed extract (*)', ' Chamomilla recutita (Matricaria) flower extract (*)', ' Arctium lappa root extract (*)', ' Helianthus annuus (Sunflower) seed oil', ' Adansonia digitata seed extract', ' Cocos nucifera (Coconut) fruit extract (*)', ' Soy amino acids', ' Wheat amino acids', ' Serine', ' Threonine', ' Arginine HCl', ' Tocopherol', ' Glycerin', ' Dipalmitoylethyl hydroxyethylmonium methosulfate', ' Benzyl alcohol', ' Behenamidopropyl dimethylamine', ' Parfum [Fragrance]', ' Lactic acid', ' Benzoic acid', ' Dehydroacetic acid', ' Coumarin.* z kontrolowanych upraw ekologicznych']",ALKEMILLA K-HAIR Odżywka prostująca i zwiększająca blask włosów 200ml,E
7,"['\xa0Aqua [Water]', ' Cetyl alcohol', ' Behenamidopropyl dimethylamine', ' Vaccinium myrtillus (Myrtle) fruit extract (*)', ' Rubus idaeus', ' (Raspberry) fruit extract (*)', ' Butyrospermum parkii (Shea butter) butter', ' Prunus amygdalus dulcis (Sweet almond) oil (*)', ' Theobroma cacao (Cocoa) seed butter (*)', ' Chamomilla recutita (Matricaria) flower extract (*)', ' Citrus medica limonum (Lemon) peel extract (*)', ' Urtica dioica (Nettle) leaf extract (*)', ' Sodium lactate', ' Sodium PCA', ' Fructose', ' Glycine', ' Inositol', ' Niacinamide', ' Urea', ' Lactic acid', ' Benzyl alcohol', ' Parfum [Fragrance]', ' Sodium benzoate', ' Caprylic/capric triglyceride', ' Myristyl lactate', ' Sodium dehydroacetate', ' Glycerin', ' Sorbitol', ' Hexyl cinnamal', ' Xanthan gum', ' Hydroxyisohexyl 3-cyclohexene carboxaldehyde', ' Hydroxycitronellal.* z kontrolowanych upraw ekologicznych']",ALKEMILLA Maska do włosów zwiększająca połysk 200ml,E
8,"[' Aqua [Water] (Eau)', ' Cetyl alcohol', ' Stearyl alcohol', ' Pogostemon cablin leaf oil', ' Amyris balsamifera bark oil', ' Myrtus communis leaf extract (*)', ' Juniperus communis fruit extract (*)', ' Eucalyptus globulus leaf extract (*)', ' Crataegus monogyna fruit extract (*)', ' Tocopherol', ' Glycerin', ' Dipalmitoylethyl hydroxyethylmonium methosulfate', ' Parfum [Fragrance]', ' Behenamidopropyl dimethylamine', ' Benzyl alcohol', ' Lactic acid', ' Benzoic acid', ' Dehydroacetic acid', ' Linalool', ' Hexyl cinnamal.']",ALKEMILLA Odżywka do włosów i brody z olejkiem patchouli 250ml,E
9,"[' Aqua', ' Cetearyl Alcohol', ' Triticum Vulgare (Wheat) Germ Oil (olej z kiełków pszenicy)', ' Behentrimonium Chloride', ' Honey (miód)', ' Glycerin', ' Lanolin', ' Theobroma Cacao (Cocoa) Seed Butter (masło kakaowe)', ' Panthenol', ' Silicone Quaternium-22', ' Polyglyceryl-3 Caprate', ' Dipropylene Glycol', ' Cocamidopropyl Betaine', ' Phenoxyethanol', ' Benzoic Acid', ' Dehydroacetic Acid', ' Parfum', ' Coumarin', ' Limonene', ' Linalool', ' Cinnamyl Alcohol.']",ANWEN 'Kiełki pszenicy i Kakao' - Maska do włosów wysokoporowatych 200ml,E
10,"[' Aqua', ' Cetearyl Alcohol', ' Triticum Vulgare (Wheat) Germ Oil (olej z kiełków pszenicy)', ' Behentrimonium Chloride', ' Honey (miód)', ' Glycerin', ' Lanolin', ' Theobroma Cacao (Cocoa) Seed Butter (masło kakaowe)', ' Panthenol', ' Silicone Quaternium-22', ' Polyglyceryl-3 Caprate', ' Dipropylene Glycol', ' Cocamidopropyl Betaine', ' Phenoxyethanol', ' Benzoic Acid', ' Dehydroacetic Acid', ' Parfum', ' Coumarin', ' Limonene', ' Linalool', ' Cinnamyl Alcohol.']",ANWEN 'Kiełki pszenicy i Kakao' - Maska do włosów wysokoporowatych SASZETKA 10ml,E
11,"['\xa0Aqua', ' Cetearyl Alcohol', ' Triticum Vulgare (Wheat) Germ Oil (olej z kiełków pszenicy)', ' Behentrimonium Chloride', ' Honey (miód)', ' Glycerin', ' Lanolin', ' Theobroma Cacao (Cocoa) Seed Butter (masło kakaowe)', ' Panthenol', ' Silicone Quaternium-22', ' Polyglyceryl-3 Caprate', ' Dipropylene Glycol', ' Cocamidopropyl Betaine', ' Phenoxyethanol', ' Benzoic Acid', ' Dehydroacetic Acid', ' Parfum', ' Coumarin', ' Limonene', ' Linalool', ' Cinnamyl Alcohol.']",ANWEN 'Kiełki pszenicy i Kakao' - Maska do włosów wysokoporowatych SZKŁO 180ml,E
12,"[' Aqua', ' Cetearyl Alcohol', ' Kaolin (glinka biała)', ' Behentrimonium Chloride', ' Cocos Nuciefera (Coconut) Oil (olej kokosowy)', ' Glycerin', ' Orbignya Oleifera Seed Oil (olej babassu)', ' Panthenol', ' Cysteine HCl', ' Arginine', ' Sodium Hyaluronate (kwas hialuronowy)', ' Phenoxyethanol', ' Benzoic Acid', ' Dehydroacetic Acid', ' Parfum', ' Limonene', ' Citronellol', ' Geraniol', ' Linalool.']",ANWEN 'Kokos i Glinka' -  Maska do włosów niskoporowatych SZKŁO 180ml,E
13,"[' Aqua', ' Cetearyl Alcohol', ' Kaolin (glinka biała)', ' Behentrimonium Chloride', ' Cocos Nuciefera (Coconut) Oil (olej kokosowy)', ' Glycerin', ' Orbignya Oleifera Seed Oil (olej babassu)', ' Panthenol', ' Cysteine HCl', ' Arginine', ' Sodium Hyaluronate (kwas hialuronowy)', ' Phenoxyethanol', ' Benzoic Acid', ' Dehydroacetic Acid', ' Parfum', ' Limonene', ' Citronellol', ' Geraniol', ' Linalool.']",ANWEN 'Kokos i Glinka' - Maska do włosów niskoporowatych 200ml,E
14,"[' Aqua', ' Cetearyl Alcohol', ' Kaolin (glinka biała)', ' Behentrimonium Chloride', ' Cocos Nucifera (Coconut) Oil (olej kokosowy)', ' Glycerin', ' Orbignya Oleifera Seed Oil (olej babassu)', ' Panthenol', ' Cysteine HCl', ' Arginine', ' Sodium Hyaluronate (kwas hialuronowy)', ' Phenoxyethanol', ' Benzoic Acid', ' Dehydroacetic Acid', ' Parfum', ' Limonene', ' Citronellol', ' Geraniol', ' Linalool.']",ANWEN 'Kokos i Glinka' - Maska do włosów niskoporowatych SASZETKA 10ml,E
15,"[' Aqua', ' Orbignya Oleifera Seed Oil', ' Cetearyl Alcohol', ' Behentrimonium Chloride', ' Astrocaryum Murumuru Seed Butter', ' Caprylic/Capric Triglyceride', ' Starch Hydroxypropyltrimonium Chloride', ' Kaolin', ' Fucus Vesiculosus Extract', ' Cetrimonium Chloride', ' Phenoxyethanol', ' Benzoic Acid', ' Dehydroacetic Acid', ' BHT', ' Parfum.']",ANWEN Emolientowa Akacja - Odżywka do włosów o niskiej porowatości 200ml,E
16,"['\xa0Aqua', ' Cetearyl Alcohol', ' Butyrospermum Parkii (Shea Butter) (masło shea)', ' Cucurbita Pepo (Pumpkin) Seed Oil (olej z pestek dyni)', ' Behentrimonium Chloride', ' Brassica Oleracea Italica Seed Oil (olej brokułowy)', ' Papaver Somniferum Seed Oil (olej makowy)', ' Carthamus Tinctorius Seed Oil (olej z krokosza barwierskiego)', ' Raphanus Sativus Seed Oil (olej z nasion rzodkiewki)', ' Cetrimonium Chloride', ' Starch Hydroxypropyltrimonium Chloride', ' Phenoxyethanol', ' Benzoic Acid', ' Dehydroacetic Acid', ' Parfum', ' Citronallol', ' Geraniol', ' Linalool.']",ANWEN Emolientowa Róża - MAŁA odżywka do włosów o wysokiej porowatości 100ml,E
17,"['\xa0Aqua', ' Cetearyl Alcohol', ' Butyrospermum Parkii (Shea Butter) (masło shea)', ' Cucurbita Pepo (Pumpkin) Seed Oil (olej z pestek dyni)', ' Behentrimonium Chloride', ' Brassica Oleracea Italica Seed Oil (olej brokułowy)', ' Papaver Somniferum Seed Oil (olej makowy)', ' Carthamus Tinctorius Seed Oil (olej z krokosza barwierskiego)', ' Raphanus Sativus Seed Oil (olej z nasion rzodkiewki)', ' Cetrimonium Chloride', ' Starch Hydroxypropyltrimonium Chloride', ' Phenoxyethanol', ' Benzoic Acid', ' Dehydroacetic Acid', ' Parfum', ' Citronallol', ' Geraniol', ' Linalool.']",ANWEN Emolientowa Róża - odżywka do włosów o wysokiej porowatości 200ml,E
18,"['\xa0Aqua', ' Macadamia Ternifolia Seed Oil (olej macadamia)', ' Cetearyl Alcohol', ' Behentrimonium Chloride', ' Brassica Oleracea Italica Seed Oil (olej brokułowy)', ' Moringa Oleifera Seed Oil (olej moringa)', ' Prunus Domestica (Plum) Seed Oil (olej z pestek śliwki)', ' Camellia Japonica Seed Oil (olej tsubaki)', ' Starch Hydroxypropyltrimonium Chloride', ' Cetrimonium Chloride', ' Phenoxyethanol', ' Benzoic Acid', ' Dehydroacetic Acid', ' Parfum.']",ANWEN Emolientowy Irys - MAŁA odżywka do włosów o średniej porowatości 100ml,E
19,"['\xa0Aqua', ' Macadamia Ternifolia Seed Oil (olej macadamia)', ' Cetearyl Alcohol', ' Behentrimonium Chloride', ' Brassica Oleracea Italica Seed Oil (olej brokułowy)', ' Moringa Oleifera Seed Oil (olej moringa)', ' Prunus Domestica (Plum) Seed Oil (olej z pestek śliwki)', ' Camellia Japonica Seed Oil (olej tsubaki)', ' Starch Hydroxypropyltrimonium Chloride', ' Cetrimonium Chloride', ' Phenoxyethanol', ' Benzoic Acid', ' Dehydroacetic Acid', ' Parfum.']",ANWEN Emolientowy Irys - odżywka do włosów o średniej porowatości 200ml,E
20,"['\xa0Aqua/Water/Eau', ' Cocos Nucifera (Coconut) Oil', ' Betaine', ' Quaternium-91', ' Cetrimonium Methosulfate', ' Cetearyl Alcohol', ' Cetyl Esters', ' Cetyl Alcohol', ' Glycerin', ' Butyrospermum Parkii (Shea) Butter', ' Phytosterols', ' Mangifera Indica (Mango) Seed Butter', ' Cocos Nucifera (Coconut) Fruit Powder', ' Citrus Reticulata (Tangerine) Fruit Extract', ' Phenoxyethanol', ' Glycerin', ' Camellia Oleifera Leaf Extract', ' Glycerin', ' Pyrus Malus (Apple) Fruit Extract', ' Glycerin', ' Phenoxyethanol', ' Citrus Limon (Lemon) Peel Extract', ' Glycerin', ' Phenoxyethanol', ' Saccharum Officinarum (Sugarcane) Extract', ' Fragrance/Parfum (Limonene)', ' Tocopheryl Acetate', ' Caprylyl Glycol', ' Phenoxyethanol', ' Sodium Benzoate', ' Polyquaternium-37', ' Propylene Glycol Dicaprylate/Dicaprate', ' PPG-1 Trideceth-6', ' Abies Balsamea (Balsam Canada) Resin', ' Caprylic/Capric Triglyceride']",AS I AM Hydration Elation Maska głęboko odżywiająca 227g,E
21,"[' Aqua/Water/Eau', ' Cetearyl Alcohol', ' Cetyl Alcohol', ' Cocos Nucifera (Coconut) Fruit Powder', ' Phyllanthus Emblica Fruit Powder', ' Beta Vulgaris (Beet) Root Extract', ' Phytosterols', ' Serenoa Serrulata Fruit Extract', ' Camellia Oleifera Leaf Extract', ' Glycerin', ' Pyrus Malus (Apple) Fruit Extract', ' Citrus Limon (Lemon) Peel Extract', ' Saccharum Officinarum (Sugar Cane) Extract', ' Betaine', ' Behentrimonium Methosulfate', ' Stearamidopropyl Dimethylamine', ' Citric Acid', ' Phenoxyethanol', ' Caprylyl Glycol', ' Potassium Sorbate', ' Polyacrylamide', ' Fragrance/Parfum', ' Anise Alcohol', ' Coumarin', ' Limonene.']",AS I AM Leave-In Conditioner Odżywka bez spłukiwania 237ml,E
22,"['\xa0Aqua/Water/Eau', ' Glycine Soja (Soybean) Oil', ' Prunus Amygdalus Dulcis (Sweet Almond) Oil', ' Theobroma Cacao (Cocoa) Seed Butter', ' Butyrospermum Parkii (Shea) Butter', ' Cetearyl Alcohol', ' Prunus Armeniaca (Apricot) Kernel Oil', ' Betaine', ' Simmondsia Chinensis (Jojoba) Seed Oil', ' Triticum Vulgare (Wheat) Germ Oil', ' Beta Vulgaris (Beet) Root Extract', ' Beeswax/Cera Alba/Cire d’abeille', ' Polyacrylamide', ' C13-14 Isoparaffin', ' Laureth-7', ' Tocopheryl Linoleate', ' BHT', ' Ascorbic Acid', ' Sodium Bicarbonate', ' Potassium Sorbate', ' Phenoxyethanol', ' Caprylyl Glycol', ' Xanthan Gum', ' Fragrance/Parfum (Anise Alcohol', ' Coumarin', ' Limonene)', ' Cetyl Alcohol', ' Polysorbate 60', ' PEG-75 Lanolin', ' Laureth-9']",AS I AM Moisture Milk Odżywka bez spłukiwania 237ml,E
23,"['\xa0Aqua', ' Cetearyl Alcohol', ' Behentrimonium Chloride', ' Vitis Vinifera Seed Oil', ' Acetum', ' Prunus Armeniaca Fruit Extract', ' Prunus Persica Fruit Extract', ' Pyrus Malus Fruit Extract', ' Panthenol', ' Olus Oil', ' Tocopherol', ' Linoleic Acid', ' Linolenic Acid', ' Tocopheryl Acetate', ' Retinyl Palmitate', ' Bioflavonoids', ' Biotin', ' Pyridoxine HCL', ' Cetrimonium Chloride', ' Propylene Glycol', ' Polysorbate 20', ' Polysorbate 80', ' Parfum', ' Linalool', ' Citric Acid.']",BARWA NATURALNA Nabłyszczająca odżywka octowa 200ml,E
24,"['\xa0Aqua', ' Cetearyl Alcohol', ' Behentrimonium Chloride', ' Persea Gratissima (Avocado) Oil', ' Vegetable Oil', ' Butyrospermum Parkii Butter', ' Cocos Nucifera Oil', ' Biotin', ' Bioflavonoids', ' Pyridoxine HCI', ' Linoleic Acid', ' Linolenic Acid', ' Tocopherol', ' Retinyl Palmitate', ' Tocopheryl Acetate', ' Panthenol', ' Glycerin', ' Cetrimonium Chloride', ' Propylene Glycol', ' Polysorbate 20', ' Citric Acid', ' Parfum', ' Benzyl Salicylate', ' Limonene.']",BARWA NATURALNA Regenerująca odżywka awokado 200ml,E
25,"[' BEHENTRIMONIUM METHOSULFATE', ' CETYL ALCOHOL', ' THEOBROMA CACAO SEED BUTTER', ' HYDROGENATED VEGETABLE OIL/SIMMONDSIA CHINESIS SEED OIL', ' MELIA AZADIRACHTA SEED OIL', ' PANAX GINSENG ROOT EXTRACT', ' SQUALANE', ' CAPRYLIC/CAPRIC TRIGLYCERIDE', ' CYMBOPOGON FLEXUOSUS OIL*', ' TOCOPHERYL ACETATE', ' ALOE BARBADENSIS EXTRACT', ' BUTYLENE GLYCOL *Citral', ' Geraniol', ' Limonene', ' Linalool.']",BIAŁY KOTEŁ Odżywka w kostce - Aloes - Neem - Żeń-szeń 30g RE-FILL,E
26,"['\xa0Nałożyć\xa0odżywkę\xa0na umyte', ' wilgotne włosy. Zmyć letnią wodą po upływie 10 - 20 minut.\xa0\n\nSkład:\xa0Aqua', ' Vitis Vinifera Seed Oil (olej z pestek winogron)', ' Cetearyl Alcohol', ' Cetyl Alcohol', ' Glycerin', ' Persea Gratissima Butter (masło\xa0avocado)', ' Stearic Acid', ' Xylitol', ' Panthenol', ' Glyceryl Laurate', ' Decyl Glucoside', ' Cocamidopropyl Betaine', ' Cyamopsis Tetragonoloba Gum', ' Sodium Alginate', ' Tocopheryl Acetate', ' Lactic Acid', ' Sodium Benzoate', ' Lavandula Angustifolia Oil (olej lawendowy)', ' Parfum.\n\nPojemność: 300ml\nProdukt zgodny z CG']",BIOLAVEN Odżywka z olejem z pestek winogron 300ml,E
27,[''],BIOLAVEN x NAPIEKNEWLOSY.PL Zestaw szampon + odżywka z olejem z pestek winogron 2x300ml,E
28,"['\xa0Water', ' Cetearyl Alcohol', ' Simmondsia Chinensis (Jojoba) Seed oil', ' Ethylhexyl Palmitate', ' Olea Europe (Olive) Fruit oil', ' Glyceryl Stearate', ' Astrocaryum Murumuru Seed butter', ' Argania Spinosa Kernel oil (Argan oil)', ' Butyrospermum Parkii (Shea) Butter', ' Ricinus Communis (Castor) Seed oil', ' Persea Gratissima (Avocado) Oil', ' Rosa Centifolia (Rose oil)', ' Citrus Aurantium Amara (Neroli) Oil', ' Tocopheryl Acetate (Vitamin E)', ' Behentrimonium Methosulfate', ' Cetrimonium Chloride', ' Biotin', ' *Nigella Sativa (Virgin Black Cumin) Oil', ' Trigonella Foenum-Graecum (Fenugreek) Seed Extract', ' Phenoxyethanol', ' Ethylhexylglycerin', ' Fragrance.\xa0*Certified Organic\xa0']",BOUNCE CURL  Moisture Balance Leave-In Conditioner Odżywka bez spłukiwania 177ml,E
29,"[' Aqua', ' Jasminum Officinale (woda jaśminowa) Flower Water', ' Cetearyl Alcohol', ' Aloe Barbadensis (Aloe Vera) extract (ekstrakt z aloesu)', ' Hamamelis Virginiana (Whitch Hazel) extract (ekstrakt z leszczyny) Prunus Amygdalus Dulcis (Sweet Almond) Oil (olej z e słodkich migdałów)', ' Caprylic/Capric Triglyceride', ' Vegetable Glyсerin', ' Behentrimonium Chloride', ' Ceramide NG', ' PEG -7 Glyceryl Cocoate', ' PEG- 60 Hydrogenated Castor oil', 'Hydroxyethylcellulose', ' Panthenol (prowitamina В5)', ' Perfume', ' Gluconolactone', ' Sodium Benzoate', ' Hydroxypropyl Guar', ' Hydroxypropyltrimonium chloride ', ' Silicone Quaternium-18', ' Trideceth-6', ' Trideceth-12', ' Polyquaternium-10', ' Benzyl Alcohol', ' Benzoic Acid', ' Dehydroacetic Acid', ' Potassium Sorbate', 'Linalool', ' Geraniol', ' Hexyl Cinnamal', ' Limonene', ' Benzyl Salycylate', ' Citral', ' Citric Acid']",CAFE MIMI Balsam do włosów - Ceramidy 300ml,E
30,"[' Aqua', ' Persea Gratissima (Avocado) Oil (olej avocado)', ' Butyrospermum parkii (Shea Butter) Oil (masło Shea)', ' Vegetable Glycerin (z roślinnych olei)', ' Moringa Pterygosperma (Moringa) Extract (ekstrakt Moringi)', ' Cetearyl Alcohol (z oleju kokosowego)', ' Behentrimonium Chloride', ' Caprylic/Capric Triglyceride', ' Lawsonia Inermis (Henna) flower extract (ekstrakt z henny)', ' Betaine (z buraków cukrowych)', ' Panthenol (prowitamina В5)', ' Tocopheryl Acetate (witamina Е)', ' Hydroxyethylcellulose (z cellulozy)', ' Perfume', ' Phenoxyethanol', ' Ethylhexylglycerin', ' Silicone Quaternium-18', ' Trideceth-6', ' Trideceth-12', 'Polyquaternium-10', ' Citric Acid']","CAFE MIMI balsam do włosów Ochrona Koloru - olej avocado, ekstrakt moringi 250ml",E
31,"['\xa0Aqua', ' Butyrospermum parkii (Shea butter) oil (masło Shea)', ' Macadamia Ternifolia (Macadamia) Seed Oil (olej macadamii)', ' Persea Gratissima (Avocado) Oil (olej avocado)', ' Euterpe Oleracea (Acai) Fruit extract (ekstrakt jagód acai)', ' Vegetable Glycerin (z olei roślinnych)', ' Cetearyl Alcohol (z oleju kokosowego)', ' Behentrimonium Chloride', ' Caprylic/Capric Triglyceride', ' Hydroxyethylcellulose (z cellulozy)', ' Hydroxypropyl Guar Hydroxypropyltrimonium Chloride (Guar Gum)', ' Panthenol (prowitamina B5)', ' Niacinamide (witamina В3)', ' Calcium Pantothenate (witamina В5)', ' Sodium Ascorbyl Phosphate (witamina С)', ' Tocopheryl Acetate (witamina Е)', ' Pyridoxine HCL (witamina В6)', ' Maltodextrin', ' Sodium Starch Octenylsuccinate', ' Silica', ' Perfume', ' Phenoxyethanol', ' Ethylhexylglycerin', 'Cyclopentasiloxane', ' Dimethiconol', ' Citric acid.']","CAFE MIMI balsam odżywienie i objętość - ekstrakt jagód acai, olej macadamia 100ml",E
32,"['\xa0Aqua', ' Butyrospermum parkii (Shea butter) oil (masło Shea)', ' Macadamia Ternifolia (Macadamia) Seed Oil (olej macadamii)', ' Persea Gratissima (Avocado) Oil (olej avocado)', ' Euterpe Oleracea (Acai) Fruit extract (ekstrakt jagód acai)', ' Vegetable Glycerin (z olei roślinnych)', ' Cetearyl Alcohol (z oleju kokosowego)', ' Behentrimonium Chloride', ' Caprylic/Capric Triglyceride', ' Hydroxyethylcellulose (z cellulozy)', ' Hydroxypropyl Guar Hydroxypropyltrimonium Chloride (Guar Gum)', ' Panthenol (prowitamina B5)', ' Niacinamide (witamina В3)', ' Calcium Pantothenate (witamina В5)', ' Sodium Ascorbyl Phosphate (witamina С)', ' Tocopheryl Acetate (witamina Е)', ' Pyridoxine HCL (witamina В6)', ' Maltodextrin', ' Sodium Starch Octenylsuccinate', ' Silica', ' Perfume', ' Phenoxyethanol', ' Ethylhexylglycerin', 'Cyclopentasiloxane', ' Dimethiconol', ' Citric acid.']","CAFE MIMI balsam odżywienie i objętość - ekstrakt jagód acai, olej macadamia 250ml",E
33,"['\xa0Aqua', ' Kaolin (White Clay)', ' Cetearyl Alcohol', ' Kaolin (Rose Clay)', ' Illite (Olea Clay', ' Citrus Aurantium Amara (Orange) Flower Extract', ' Phyllanthus Emblica (Amla) Fruit Extract', ' Prunus Armeniaca Fruit Extract', ' Behentrimonium Chloride', ' Vegetable Glycerin', ' Butyrospermum parkii (shea butter) oil', ' Caprylic/Capric Triglyceride', ' Rosamarinus Officinalis Leaf Extract', ' Behentrimonium Methosulfate', ' Quaternium-87', ' Benzyl Alcohol', ' Ethylhexylglycerin', ' Silk Amino Acids', ' Vegetable Glycerin', ' Panthenol', ' Tocopherol Acetate (Vitamin E)', ' Perfume', ' Hydroxyethylcellulose', ' Polyquaternium-10', ' Citric Acid', ' Potassium Sorbate', ' Sodium Benzoate']",CAFE MIMI Maska 3 Glinki do włosów tłustych u nasady i suchych na końcach 220ml,E
34,"['\xa0Aqua', ' Butyrospermum Parkii (Shea) Butter', ' Orchis Mascula (Orchid) Flower Extract', ' Vegetable Glycerin', ' Cetearyl Alcohol', ' Behentrimonium Chloride', ' Caprylic/Capric Triglyceride', ' Vitis Vinifera (Grape) Seed Oil', ' Panthenol', ' Cyclopentasiloxane', ' Dimethiconol', ' Benzyl Alcohol', ' Ethylhexylglycerin', ' Perfume', ' Hydroxyethylcellulose', ' Polyquaternium-10', ' Citric Acid.']",CAFE MIMI Maska do włosów Aktywacja wzrostu 220ml,E
35,"[' Aqua', ' Vaccinium Angustifolium Fruit Extract', ' Сосоs nucifera (Сосоs) Oil', ' Vegetable Glycerin', ' Cetearyl Alcohol', ' Caprylic/Capric Triglyceride', ' Behentrimonium Chloride', ' Behenamidopropyl Dimethylamine', ' Benzyl Alcohol', ' Ethylhexylglycerin', ' Perfume', ' Dipropylene Glycol', ' Polysilicone-29', ' Hydroxyethylcellulose', ' Panthenol', ' Hydroxypropyl Guar', ' Hydroxypropyl Guar Hydroxypropyltrimonium Chloride', ' Lactic Acid.']",CAFE MIMI Maska do włosów zniszczonych i farbowanych Odżywienie i regeneracja 220ml,E
36,"['\xa0Distilled Water', ' Cocos Nucifera (Coconut) Water', ' Cetearyl alcohol', ' Cetyl Alcohol', ' Behentrimonium Methosulfate', ' Cocos Nucifera (Coconut) Fruit Extract', ' Althaea Officinalis (Marshmallow) Leaf/ Root Extract', ' Linum Usitatissimum (Flax Seed) Oil', ' Butyrospermum Parkii Glycerides (Shea Butter)', ' Butylene Glycol', ' Vitis Vinifera (Grape) Seed Oil', ' Camellia Sinensis (Green Tea) Leaf Extract', ' Cannabis Sativa (Hemp Seed) Oil', ' Helianthus Annuus (Sunflower Seed) Oil', ' Phenoxyethanol and Caprylyl Glycol (Optiphen ND)', ' Aloe Ferox Powder', ' Marshmallow Root', ' Yucca Root', ' Blue Cohosh', '\xa0scent and LOVE!']",CAMILLE ROSE NATURALS Coconut Water Leave In Detangling Hair Treatment odżywka bez spłukiwania 240ml,E
37,"['\xa0Distilled water', ' cocos nucifera (coconut) water', ' ricinus communis (castor) seed oil', ' europaea ( olive) fruit oil', ' vaccinium myrtillus (bilberry) extract', ' saccharum officinarum (sugar cane) extract', ' citrus aurantium dulcis (orange) fruit extract', ' citrus medica limonum (lemon)fruit extract', ' behentrimonium methosulfate ( btms)', ' cocos nucifera (coconut) fruit extract', ' aloe barbadensis leaf juice', ' phenoxyethanol and caprylyl glycol (optiphen)', '\xa0scent and LOVE!']",CAMILLE ROSE NATURALS Coconut Water Style Setter odżywka bez spłukiwania 240ml,E
